{
  "id": "cal.fred_1979_1986",
  "name": "cal.fred_1979_1986.name",
  "desc": "cal.fred_1979_1986.desc",
  "source": "https://fred.stlouisfed.org/series/CPIAUCSL+UNRATE+FEDFUNDS",
  "series": [
    {"date": "1979-08", "inflation_yoy": 0.1184, "unemployment": 0.06, "fed_funds_rate": 0.1094},
    {"date": "1979-09", "inflation_yoy": 0.1188, "unemployment": 0.059, "fed_funds_rate": 0.1143},
    {"date": "1979-10", "inflation_yoy": 0.1207, "unemployment": 0.06, "fed_funds_rate": 0.1377},
    {"date": "1979-11", "inflation_yoy": 0.1259, "unemployment": 0.059, "fed_funds_rate": 0.1318},
    {"date": "1979-12", "inflation_yoy": 0.1325, "unemployment": 0.06, "fed_funds_rate": 0.1378},
    {"date": "1980-01", "inflation_yoy": 0.1387, "unemployment": 0.063, "fed_funds_rate": 0.1382},
    {"date": "1980-02", "inflation_yoy": 0.1416, "unemployment": 0.063, "fed_funds_rate": 0.1413},
    {"date": "1980-03", "inflation_yoy": 0.1459, "unemployment": 0.063, "fed_funds_rate": 0.1719},
    {"date": "1980-04", "inflation_yoy": 0.1459, "unemployment": 0.069, "fed_funds_rate": 0.1761},
    {"date": "1980-05", "inflation_yoy": 0.1443, "unemployment": 0.075, "fed_funds_rate": 0.1098},
    {"date": "1980-06", "inflation_yoy": 0.1427, "unemployment": 0.076, "fed_funds_rate": 0.0947},
    {"date": "1980-07", "inflation_yoy": 0.1315, "unemployment": 0.078, "fed_funds_rate": 0.0903},
    {"date": "1980-08", "inflation_yoy": 0.1289, "unemployment": 0.077, "fed_funds_rate": 0.0961},
    {"date": "1980-09", "inflation_yoy": 0.1277, "unemployment": 0.075, "fed_funds_rate": 0.1087},
    {"date": "1980-10", "inflation_yoy": 0.1263, "unemployment": 0.075, "fed_funds_rate": 0.1281},
    {"date": "1980-11", "inflation_yoy": 0.1263, "unemployment": 0.075, "fed_funds_rate": 0.1585},
    {"date": "1980-12", "inflation_yoy": 0.1235, "unemployment": 0.072, "fed_funds_rate": 0.189},
    {"date": "1981-01", "inflation_yoy": 0.1179, "unemployment": 0.075, "fed_funds_rate": 0.1908},
    {"date": "1981-02", "inflation_yoy": 0.1139, "unemployment": 0.074, "fed_funds_rate": 0.1593},
    {"date": "1981-03", "inflation_yoy": 0.1061, "unemployment": 0.074, "fed_funds_rate": 0.147},
    {"date": "1981-04", "inflation_yoy": 0.1014, "unemployment": 0.072, "fed_funds_rate": 0.1572},
    {"date": "1981-05", "inflation_yoy": 0.0979, "unemployment": 0.075, "fed_funds_rate": 0.1852},
    {"date": "1981-06", "inflation_yoy": 0.097, "unemployment": 0.075, "fed_funds_rate": 0.191},
    {"date": "1981-07", "inflation_yoy": 0.1077, "unemployment": 0.072, "fed_funds_rate": 0.1904},
    {"date": "1981-08", "inflation_yoy": 0.1082, "unemployment": 0.074, "fed_funds_rate": 0.1782},
    {"date": "1981-09", "inflation_yoy": 0.1097, "unemployment": 0.076, "fed_funds_rate": 0.1587},
    {"date": "1981-10", "inflation_yoy": 0.1027, "unemployment": 0.079, "fed_funds_rate": 0.1508},
    {"date": "1981-11", "inflation_yoy": 0.0958, "unemployment": 0.083, "fed_funds_rate": 0.1331},
    {"date": "1981-12", "inflation_yoy": 0.0891, "unemployment": 0.085, "fed_funds_rate": 0.1237},
    {"date": "1982-01", "inflation_yoy": 0.0826, "unemployment": 0.086, "fed_funds_rate": 0.1322},
    {"date": "1982-02", "inflation_yoy": 0.0761, "unemployment": 0.089, "fed_funds_rate": 0.1478},
    {"date": "1982-03", "inflation_yoy": 0.0688, "unemployment": 0.09, "fed_funds_rate": 0.1468},
    {"date": "1982-04", "inflation_yoy": 0.0662, "unemployment": 0.093, "fed_funds_rate": 0.1494},
    {"date": "1982-05", "inflation_yoy": 0.0691, "unemployment": 0.094, "fed_funds_rate": 0.1445},
    {"date": "1982-06", "inflation_yoy": 0.0718, "unemployment": 0.096, "fed_funds_rate": 0.1415},
    {"date": "1982-07", "inflation_yoy": 0.0656, "unemployment": 0.098, "fed_funds_rate": 0.1259},
    {"date": "1982-08", "inflation_yoy": 0.0597, "unemployment": 0.098, "fed_funds_rate": 0.1012},
    {"date": "1982-09", "inflation_yoy": 0.0494, "unemployment": 0.101, "fed_funds_rate": 0.1031},
    {"date": "1982-10", "inflation_yoy": 0.0503, "unemployment": 0.104, "fed_funds_rate": 0.0971},
    {"date": "1982-11", "inflation_yoy": 0.0448, "unemployment": 0.108, "fed_funds_rate": 0.092},
    {"date": "1982-12", "inflation_yoy": 0.0383, "unemployment": 0.108, "fed_funds_rate": 0.0895},
    {"date": "1983-01", "inflation_yoy": 0.0371, "unemployment": 0.104, "fed_funds_rate": 0.0868},
    {"date": "1983-02", "inflation_yoy": 0.0348, "unemployment": 0.104, "fed_funds_rate": 0.0851},
    {"date": "1983-03", "inflation_yoy": 0.0359, "unemployment": 0.103, "fed_funds_rate": 0.0877},
    {"date": "1983-04", "inflation_yoy": 0.04, "unemployment": 0.102, "fed_funds_rate": 0.088},
    {"date": "1983-05", "inflation_yoy": 0.0344, "unemployment": 0.101, "fed_funds_rate": 0.0863},
    {"date": "1983-06", "inflation_yoy": 0.0247, "unemployment": 0.101, "fed_funds_rate": 0.0898},
    {"date": "1983-07", "inflation_yoy": 0.0236, "unemployment": 0.094, "fed_funds_rate": 0.0937},
    {"date": "1983-08", "inflation_yoy": 0.0246, "unemployment": 0.095, "fed_funds_rate": 0.0956},
    {"date": "1983-09", "inflation_yoy": 0.0276, "unemployment": 0.092, "fed_funds_rate": 0.0945},
    {"date": "1983-10", "inflation_yoy": 0.0275, "unemployment": 0.088, "fed_funds_rate": 0.0948},
    {"date": "1983-11", "inflation_yoy": 0.0316, "unemployment": 0.085, "fed_funds_rate": 0.0934},
    {"date": "1983-12", "inflation_yoy": 0.0379, "unemployment": 0.083, "fed_funds_rate": 0.0947},
    {"date": "1984-01", "inflation_yoy": 0.0429, "unemployment": 0.08, "fed_funds_rate": 0.0956},
    {"date": "1984-02", "inflation_yoy": 0.0469, "unemployment": 0.078, "fed_funds_rate": 0.0959},
    {"date": "1984-03", "inflation_yoy": 0.0489, "unemployment": 0.078, "fed_funds_rate": 0.0991},
    {"date": "1984-04", "inflation_yoy": 0.0455, "unemployment": 0.077, "fed_funds_rate": 0.1029},
    {"date": "1984-05", "inflation_yoy": 0.0433, "unemployment": 0.074, "fed_funds_rate": 0.1032},
    {"date": "1984-06", "inflation_yoy": 0.0433, "unemployment": 0.072, "fed_funds_rate": 0.1106},
    {"date": "1984-07", "inflation_yoy": 0.0431, "unemployment": 0.075, "fed_funds_rate": 0.1123},
    {"date": "1984-08", "inflation_yoy": 0.043, "unemployment": 0.075, "fed_funds_rate": 0.1164},
    {"date": "1984-09", "inflation_yoy": 0.0428, "unemployment": 0.073, "fed_funds_rate": 0.113},
    {"date": "1984-10", "inflation_yoy": 0.0427, "unemployment": 0.074, "fed_funds_rate": 0.0999},
    {"date": "1984-11", "inflation_yoy": 0.0415, "unemployment": 0.072, "fed_funds_rate": 0.0943},
    {"date": "1984-12", "inflation_yoy": 0.0404, "unemployment": 0.073, "fed_funds_rate": 0.0838},
    {"date": "1985-01", "inflation_yoy": 0.0353, "unemployment": 0.073, "fed_funds_rate": 0.0835},
    {"date": "1985-02", "inflation_yoy": 0.0361, "unemployment": 0.072, "fed_funds_rate": 0.085},
    {"date": "1985-03", "inflation_yoy": 0.0379, "unemployment": 0.072, "fed_funds_rate": 0.0858},
    {"date": "1985-04", "inflation_yoy": 0.0358, "unemployment": 0.073, "fed_funds_rate": 0.0827},
    {"date": "1985-05", "inflation_yoy": 0.0357, "unemployment": 0.072, "fed_funds_rate": 0.0797},
    {"date": "1985-06", "inflation_yoy": 0.0366, "unemployment": 0.074, "fed_funds_rate": 0.0753},
    {"date": "1985-07", "inflation_yoy": 0.0346, "unemployment": 0.074, "fed_funds_rate": 0.0788},
    {"date": "1985-08", "inflation_yoy": 0.0335, "unemployment": 0.071, "fed_funds_rate": 0.079},
    {"date": "1985-09", "inflation_yoy": 0.0325, "unemployment": 0.071, "fed_funds_rate": 0.0792},
    {"date": "1985-10", "inflation_yoy": 0.0324, "unemployment": 0.071, "fed_funds_rate": 0.0799},
    {"date": "1985-11", "inflation_yoy": 0.0351, "unemployment": 0.07, "fed_funds_rate": 0.0805},
    {"date": "1985-12", "inflation_yoy": 0.0379, "unemployment": 0.07, "fed_funds_rate": 0.0827},
    {"date": "1986-01", "inflation_yoy": 0.0397, "unemployment": 0.067, "fed_funds_rate": 0.0814},
    {"date": "1986-02", "inflation_yoy": 0.032, "unemployment": 0.072, "fed_funds_rate": 0.0786},
    {"date": "1986-03", "inflation_yoy": 0.0215, "unemployment": 0.072, "fed_funds_rate": 0.0748},
    {"date": "1986-04", "inflation_yoy": 0.0159, "unemployment": 0.071, "fed_funds_rate": 0.0699},
    {"date": "1986-05", "inflation_yoy": 0.0168, "unemployment": 0.072, "fed_funds_rate": 0.0685},
    {"date": "1986-06", "inflation_yoy": 0.0177, "unemployment": 0.072, "fed_funds_rate": 0.0692},
    {"date": "1986-07", "inflation_yoy": 0.0167, "unemployment": 0.07, "fed_funds_rate": 0.0656},
    {"date": "1986-08", "inflation_yoy": 0.0158, "unemployment": 0.069, "fed_funds_rate": 0.0617},
    {"date": "1986-09", "inflation_yoy": 0.0176, "unemployment": 0.07, "fed_funds_rate": 0.0589},
    {"date": "1986-10", "inflation_yoy": 0.0157, "unemployment": 0.07, "fed_funds_rate": 0.0585},
    {"date": "1986-11", "inflation_yoy": 0.0128, "unemployment": 0.069, "fed_funds_rate": 0.0604},
    {"date": "1986-12", "inflation_yoy": 0.0119, "unemployment": 0.066, "fed_funds_rate": 0.0691}
  ]
}
